{
  "name": "Scout (Lv10)",
  "archetype": "Scout",
  "level": 10,
  "hp": 138,
  "ac": 29,
  "fort": 19,
  "ref": 20,
  "will": 18,
  "speed": 30,
  "max_ap": 8,
  "status": 1,
  "civil_spire_legal": false,
  "civil_ac_penalty": -4,
  "unarmed_damage_dice": "1d4",
  "unarmed_bonus": 17,
  "unarmed_flat_dmg": 4,
  "unarmed_traits": [
    "agile",
    "nonlethal"
  ],
  "weapons": [
    {
      "name": "Composite Longbow",
      "attack_bonus": 21,
      "damage_dice": "3d8",
      "flat_damage": 4,
      "damage_type": "P",
      "range": 100,
      "ap_cost": 0,
      "traits": [
        "deadly_d10",
        "propulsive"
      ],
      "allowed_environments": [
        "high_radiant",
        "low_radiant",
        "the_neither"
      ]
    },
    {
      "name": "Hunting Shortsword",
      "attack_bonus": 19,
      "damage_dice": "3d6",
      "flat_damage": 4,
      "damage_type": "P/S",
      "range": 0,
      "ap_cost": 0,
      "traits": [
        "agile",
        "finesse"
      ],
      "allowed_environments": [
        "civil_spire",
        "high_radiant",
        "low_radiant",
        "the_neither"
      ]
    }
  ],
  "abilities": {
    "damage_resistance_physical": 1
  }
}