{
  "name": "Storm Titan Bear (Brute Lv15)",
  "archetype": "BruteBear",
  "level": 15,
  "hp": 350,
  "ac": 37,
  "fort": 30,
  "ref": 23,
  "will": 24,
  "speed": 65,
  "max_ap": 0,
  "status": 0,
  "civil_spire_legal": false,
  "civil_ac_penalty": 0,
  "unarmed_damage_dice": "4d8",
  "unarmed_bonus": 30,
  "unarmed_flat_dmg": 16,
  "unarmed_traits": [
    "agile"
  ],
  "weapons": [
    {
      "name": "Abyssal Jaws",
      "attack_bonus": 30,
      "damage_dice": "4d12",
      "flat_damage": 18,
      "damage_type": "P",
      "range": 0,
      "ap_cost": 0,
      "traits": [
        "deadly_d12"
      ],
      "allowed_environments": [
        "civil_spire",
        "high_radiant",
        "low_radiant",
        "the_neither"
      ]
    },
    {
      "name": "Abyssal Claws",
      "attack_bonus": 30,
      "damage_dice": "4d8",
      "flat_damage": 16,
      "damage_type": "S",
      "range": 0,
      "ap_cost": 0,
      "traits": [
        "agile"
      ],
      "allowed_environments": [
        "civil_spire",
        "high_radiant",
        "low_radiant",
        "the_neither"
      ]
    }
  ],
  "abilities": {
    "damage_resistance_physical": 10,
    "feral_adrenaline_surge": true,
    "surge_temp_hp": 45
  }
}