{
  "name": "BlackMarketeer (Lv10)",
  "archetype": "BlackMarketeer",
  "level": 10,
  "hp": 108,
  "ac": 28,
  "fort": 16,
  "ref": 21,
  "will": 19,
  "speed": 25,
  "max_ap": 9,
  "status": 3,
  "civil_spire_legal": true,
  "civil_ac_penalty": 0,
  "unarmed_damage_dice": "1d4",
  "unarmed_bonus": 16,
  "unarmed_flat_dmg": 2,
  "unarmed_traits": [
    "agile",
    "nonlethal"
  ],
  "weapons": [
    {
      "name": "Black-Market Stiletto",
      "attack_bonus": 19,
      "damage_dice": "3d4",
      "flat_damage": 8,
      "damage_type": "P",
      "range": 0,
      "ap_cost": 0,
      "traits": [
        "agile",
        "finesse",
        "deadly_d8"
      ],
      "allowed_environments": [
        "civil_spire",
        "high_radiant",
        "low_radiant",
        "the_neither"
      ]
    },
    {
      "name": "Bootleg Snub Cartridge Gun",
      "attack_bonus": 18,
      "damage_dice": "3d8",
      "flat_damage": 5,
      "damage_type": "P",
      "range": 30,
      "ap_cost": 0,
      "traits": [
        "cartridge",
        "fatal_d10",
        "concealed"
      ],
      "ammo_capacity": 4,
      "reload_actions": 1,
      "allowed_environments": [
        "high_radiant",
        "low_radiant",
        "the_neither"
      ]
    }
  ],
  "abilities": {
    "armed_retainers": true,
    "retainer_count": 3,
    "retainer_hp": 32,
    "retainer_attack": 11,
    "retainer_damage_dice": "2d6",
    "retainer_flat_damage": 3
  }
}