{
  "name": "Black Bear (Lv1 - Berserk)",
  "archetype": "BruteBear",
  "level": 1,
  "hp": 22,
  "ac": 15,
  "fort": 8,
  "ref": 5,
  "will": 5,
  "speed": 35,
  "max_ap": 0,
  "status": 0,
  "civil_spire_legal": false,
  "civil_ac_penalty": 0,
  "unarmed_damage_dice": "1d6",
  "unarmed_bonus": 7,
  "unarmed_flat_dmg": 3,
  "unarmed_traits": [
    "agile"
  ],
  "weapons": [
    {
      "name": "Feral Jaws",
      "attack_bonus": 7,
      "damage_dice": "1d8",
      "flat_damage": 3,
      "damage_type": "P",
      "range": 0,
      "ap_cost": 0,
      "traits": [],
      "allowed_environments": [
        "civil_spire",
        "high_radiant",
        "low_radiant",
        "the_neither"
      ]
    },
    {
      "name": "Heavy Claws",
      "attack_bonus": 7,
      "damage_dice": "1d6",
      "flat_damage": 3,
      "damage_type": "S",
      "range": 0,
      "ap_cost": 0,
      "traits": [
        "agile"
      ],
      "allowed_environments": [
        "civil_spire",
        "high_radiant",
        "low_radiant",
        "the_neither"
      ]
    }
  ],
  "abilities": {
    "damage_resistance_physical": 1
  }
}