{
  "name": "Noble (Lv10)",
  "archetype": "Noble",
  "level": 10,
  "hp": 108,
  "ac": 28,
  "fort": 15,
  "ref": 18,
  "will": 21,
  "speed": 25,
  "max_ap": 8,
  "status": 6,
  "civil_spire_legal": true,
  "civil_ac_penalty": 0,
  "unarmed_damage_dice": "1d4",
  "unarmed_bonus": 13,
  "unarmed_flat_dmg": 1,
  "unarmed_traits": [
    "agile",
    "nonlethal"
  ],
  "weapons": [
    {
      "name": "Ancestral Fair Steel Rapier",
      "attack_bonus": 20,
      "damage_dice": "3d6",
      "flat_damage": 5,
      "damage_type": "P",
      "range": 0,
      "ap_cost": 0,
      "traits": [
        "deadly_d8",
        "disarm",
        "finesse"
      ],
      "allowed_environments": [
        "civil_spire",
        "high_radiant",
        "low_radiant",
        "the_neither"
      ]
    },
    {
      "name": "Elven Dueling Pistol",
      "attack_bonus": 17,
      "damage_dice": "3d8",
      "flat_damage": 3,
      "damage_type": "P",
      "range": 40,
      "ap_cost": 0,
      "traits": [
        "cartridge",
        "fatal_d10"
      ],
      "ammo_capacity": 1,
      "reload_actions": 1,
      "allowed_environments": [
        "high_radiant",
        "low_radiant",
        "the_neither"
      ]
    }
  ],
  "abilities": {
    "armed_retainers": true,
    "retainer_count": 3,
    "retainer_hp": 35,
    "retainer_attack": 12,
    "retainer_damage_dice": "2d8",
    "retainer_flat_damage": 3,
    "social_authority_bonus": 5
  }
}