{
  "name": "Fungal Spore Sprayer (Lv10 - Flee 50%)",
  "archetype": "SporeSprayer",
  "level": 10,
  "hp": 65,
  "ac": 29,
  "fort": 21,
  "ref": 16,
  "will": 19,
  "speed": 40,
  "max_ap": 0,
  "status": 0,
  "civil_spire_legal": false,
  "civil_ac_penalty": 0,
  "unarmed_damage_dice": "3d6",
  "unarmed_bonus": 20,
  "unarmed_flat_dmg": 8,
  "unarmed_traits": [
    "agile"
  ],
  "weapons": [
    {
      "name": "Choking Spore Cloud",
      "attack_bonus": 0,
      "damage_dice": "6d6",
      "flat_damage": 10,
      "damage_type": "Poison",
      "range": 30,
      "ap_cost": 0,
      "traits": [
        "poison",
        "spore",
        "range_30"
      ],
      "allowed_environments": [
        "civil_spire",
        "high_radiant",
        "low_radiant",
        "the_neither"
      ],
      "save_type": "fort",
      "save_dc": 27,
      "save_damage_dice": "6d6",
      "save_flat_damage": 10,
      "action_cost": 2,
      "cooldown_rounds": 0
    },
    {
      "name": "Barbed Tendril / Mandible",
      "attack_bonus": 20,
      "damage_dice": "3d6",
      "flat_damage": 8,
      "damage_type": "P",
      "range": 0,
      "ap_cost": 0,
      "traits": [
        "agile"
      ],
      "allowed_environments": [
        "civil_spire",
        "high_radiant",
        "low_radiant",
        "the_neither"
      ]
    }
  ],
  "abilities": {}
}