{
  "name": "Chirurgeon (Lv10)",
  "archetype": "Chirurgeon",
  "level": 10,
  "hp": 108,
  "ac": 27,
  "fort": 20,
  "ref": 18,
  "will": 18,
  "speed": 25,
  "max_ap": 8,
  "status": 3,
  "civil_spire_legal": true,
  "civil_ac_penalty": 0,
  "unarmed_damage_dice": "1d4",
  "unarmed_bonus": 14,
  "unarmed_flat_dmg": 1,
  "unarmed_traits": [
    "agile",
    "nonlethal"
  ],
  "weapons": [
    {
      "name": "Surgical Scalpel / Lancet",
      "attack_bonus": 18,
      "damage_dice": "3d4",
      "flat_damage": 4,
      "damage_type": "P/S",
      "range": 0,
      "ap_cost": 0,
      "traits": [
        "agile",
        "finesse",
        "deadly_d8"
      ],
      "allowed_environments": [
        "civil_spire",
        "high_radiant",
        "low_radiant",
        "the_neither"
      ]
    },
    {
      "name": "Corrosive Acid Phial",
      "attack_bonus": 17,
      "damage_dice": "3d6",
      "flat_damage": 6,
      "damage_type": "Acid",
      "range": 30,
      "ap_cost": 0,
      "traits": [
        "bomb"
      ],
      "allowed_environments": [
        "high_radiant",
        "low_radiant",
        "the_neither"
      ]
    }
  ],
  "abilities": {}
}