{
  "name": "Neither Grizzly (Lv10 - Flee 50%)",
  "archetype": "BruteBear",
  "level": 10,
  "hp": 67,
  "ac": 29,
  "fort": 20,
  "ref": 16,
  "will": 17,
  "speed": 45,
  "max_ap": 0,
  "status": 0,
  "civil_spire_legal": false,
  "civil_ac_penalty": 0,
  "unarmed_damage_dice": "3d6",
  "unarmed_bonus": 20,
  "unarmed_flat_dmg": 8,
  "unarmed_traits": [
    "agile"
  ],
  "weapons": [
    {
      "name": "Grizzly Jaws",
      "attack_bonus": 20,
      "damage_dice": "3d8",
      "flat_damage": 9,
      "damage_type": "P",
      "range": 0,
      "ap_cost": 0,
      "traits": [
        "deadly_d10"
      ],
      "allowed_environments": [
        "civil_spire",
        "high_radiant",
        "low_radiant",
        "the_neither"
      ]
    },
    {
      "name": "Grizzly Claws",
      "attack_bonus": 20,
      "damage_dice": "3d6",
      "flat_damage": 8,
      "damage_type": "S",
      "range": 0,
      "ap_cost": 0,
      "traits": [
        "agile"
      ],
      "allowed_environments": [
        "civil_spire",
        "high_radiant",
        "low_radiant",
        "the_neither"
      ]
    }
  ],
  "abilities": {
    "damage_resistance_physical": 4
  }
}