{
  "name": "Caustic Acid Spitter (Lv7 - Flee 50%)",
  "archetype": "AcidSpitter",
  "level": 7,
  "hp": 44,
  "ac": 25,
  "fort": 15,
  "ref": 17,
  "will": 12,
  "speed": 40,
  "max_ap": 0,
  "status": 0,
  "civil_spire_legal": false,
  "civil_ac_penalty": 0,
  "unarmed_damage_dice": "2d8",
  "unarmed_bonus": 16,
  "unarmed_flat_dmg": 7,
  "unarmed_traits": [
    "agile"
  ],
  "weapons": [
    {
      "name": "Caustic Acid Stream",
      "attack_bonus": 0,
      "damage_dice": "4d8",
      "flat_damage": 6,
      "damage_type": "Acid",
      "range": 30,
      "ap_cost": 0,
      "traits": [
        "acid",
        "area",
        "range_30"
      ],
      "allowed_environments": [
        "civil_spire",
        "high_radiant",
        "low_radiant",
        "the_neither"
      ],
      "save_type": "ref",
      "save_dc": 23,
      "save_damage_dice": "4d8",
      "save_flat_damage": 6,
      "action_cost": 2,
      "cooldown_rounds": 0
    },
    {
      "name": "Barbed Tendril / Mandible",
      "attack_bonus": 16,
      "damage_dice": "2d8",
      "flat_damage": 7,
      "damage_type": "P",
      "range": 0,
      "ap_cost": 0,
      "traits": [
        "agile"
      ],
      "allowed_environments": [
        "civil_spire",
        "high_radiant",
        "low_radiant",
        "the_neither"
      ]
    }
  ],
  "abilities": {}
}