{
  "name": "Resonator Disorientor (Lv3 - Berserk)",
  "archetype": "Disorientor",
  "level": 3,
  "hp": 50,
  "ac": 19,
  "fort": 8,
  "ref": 10,
  "will": 12,
  "speed": 35,
  "max_ap": 0,
  "status": 0,
  "civil_spire_legal": false,
  "civil_ac_penalty": 0,
  "unarmed_damage_dice": "2d4",
  "unarmed_bonus": 11,
  "unarmed_flat_dmg": 3,
  "unarmed_traits": [
    "agile"
  ],
  "weapons": [
    {
      "name": "Disorienting Harmonic Pulse",
      "attack_bonus": 0,
      "damage_dice": "2d8",
      "flat_damage": 5,
      "damage_type": "NonLethal",
      "range": 30,
      "ap_cost": 0,
      "traits": [
        "mental",
        "sonic",
        "nonlethal",
        "range_30"
      ],
      "allowed_environments": [
        "civil_spire",
        "high_radiant",
        "low_radiant",
        "the_neither"
      ],
      "save_type": "will",
      "save_dc": 20,
      "save_damage_dice": "2d8",
      "save_flat_damage": 5,
      "action_cost": 2,
      "cooldown_rounds": 0
    },
    {
      "name": "Barbed Tendril / Mandible",
      "attack_bonus": 11,
      "damage_dice": "2d4",
      "flat_damage": 3,
      "damage_type": "P",
      "range": 0,
      "ap_cost": 0,
      "traits": [
        "agile"
      ],
      "allowed_environments": [
        "civil_spire",
        "high_radiant",
        "low_radiant",
        "the_neither"
      ]
    }
  ],
  "abilities": {}
}