{
  "name": "Scholar (Lv10)",
  "archetype": "Scholar",
  "level": 10,
  "hp": 88,
  "ac": 26,
  "fort": 15,
  "ref": 16,
  "will": 21,
  "speed": 25,
  "max_ap": 16,
  "status": 4,
  "civil_spire_legal": true,
  "civil_ac_penalty": 0,
  "unarmed_damage_dice": "1d4",
  "unarmed_bonus": 12,
  "unarmed_flat_dmg": 0,
  "unarmed_traits": [
    "agile",
    "nonlethal"
  ],
  "weapons": [
    {
      "name": "High Radiant Arc Resonator",
      "attack_bonus": 19,
      "damage_dice": "3d12",
      "flat_damage": 8,
      "damage_type": "Electricity",
      "range": 80,
      "ap_cost": 3,
      "traits": [
        "radiant",
        "deadly_d10"
      ],
      "allowed_environments": [
        "high_radiant"
      ]
    },
    {
      "name": "Technical Cartridge Sidearm",
      "attack_bonus": 18,
      "damage_dice": "3d8",
      "flat_damage": 4,
      "damage_type": "P",
      "range": 40,
      "ap_cost": 0,
      "traits": [
        "cartridge",
        "fatal_d10"
      ],
      "ammo_capacity": 6,
      "reload_actions": 1,
      "allowed_environments": [
        "low_radiant",
        "the_neither"
      ]
    },
    {
      "name": "Scholastic Stave / Cane",
      "attack_bonus": 14,
      "damage_dice": "2d6",
      "flat_damage": 2,
      "damage_type": "B",
      "range": 0,
      "ap_cost": 0,
      "traits": [
        "finesse"
      ],
      "allowed_environments": [
        "civil_spire",
        "high_radiant",
        "low_radiant",
        "the_neither"
      ]
    }
  ],
  "abilities": {
    "radiant_barrier": true,
    "barrier_temp_hp_high": 30,
    "barrier_temp_hp_low": 12
  }
}