{
  "name": "Soldier (Lv5 - Untagged 3 AP Pulse)",
  "archetype": "Soldier",
  "level": 5,
  "hp": 73,
  "ac": 24,
  "fort": 13,
  "ref": 10,
  "will": 10,
  "speed": 20,
  "max_ap": 6,
  "status": 2,
  "civil_spire_legal": false,
  "civil_ac_penalty": -5,
  "unarmed_damage_dice": "1d4",
  "unarmed_bonus": 11,
  "unarmed_flat_dmg": 4,
  "unarmed_traits": [
    "agile",
    "nonlethal"
  ],
  "weapons": [
    {
      "name": "Master Broadsword",
      "attack_bonus": 15,
      "damage_dice": "2d8",
      "flat_damage": 4,
      "damage_type": "S",
      "range": 0,
      "ap_cost": 0,
      "traits": [
        "versatile_p"
      ],
      "allowed_environments": [
        "high_radiant",
        "low_radiant",
        "the_neither"
      ]
    },
    {
      "name": "Heavy Wrench / Club (Civil)",
      "attack_bonus": 13,
      "damage_dice": "2d6",
      "flat_damage": 4,
      "damage_type": "B",
      "range": 0,
      "ap_cost": 0,
      "traits": [],
      "allowed_environments": [
        "civil_spire"
      ]
    }
  ],
  "abilities": {
    "shield_block": false,
    "shield_hardness": 0,
    "shield_hp": 0,
    "shield_raised_ac_bonus": 2,
    "pulse_defense": {
      "name": "Kinetic Deflection Brooch (Untagged)",
      "base_ap_cost": 3,
      "has_discipline_tag": false,
      "ap_cost": 3,
      "ac_bonus": 3,
      "fort_bonus": 0,
      "ref_bonus": 0,
      "will_bonus": 0
    }
  }
}