{
  "name": "MadBomber (Lv1)",
  "archetype": "MadBomber",
  "level": 1,
  "hp": 17,
  "ac": 15,
  "fort": 7,
  "ref": 7,
  "will": 5,
  "speed": 25,
  "max_ap": 3,
  "status": 1,
  "civil_spire_legal": false,
  "civil_ac_penalty": -3,
  "unarmed_damage_dice": "1d4",
  "unarmed_bonus": 4,
  "unarmed_flat_dmg": 0,
  "unarmed_traits": [
    "agile",
    "nonlethal"
  ],
  "weapons": [
    {
      "name": "Volatile Nitro Bomb",
      "attack_bonus": 7,
      "damage_dice": "1d8",
      "flat_damage": 3,
      "damage_type": "Fire",
      "range": 40,
      "ap_cost": 0,
      "traits": [
        "bomb",
        "splash"
      ],
      "allowed_environments": [
        "high_radiant",
        "low_radiant",
        "the_neither"
      ]
    },
    {
      "name": "Trench Dagger",
      "attack_bonus": 5,
      "damage_dice": "1d4",
      "flat_damage": 1,
      "damage_type": "P",
      "range": 0,
      "ap_cost": 0,
      "traits": [
        "agile",
        "finesse"
      ],
      "allowed_environments": [
        "civil_spire",
        "high_radiant",
        "low_radiant",
        "the_neither"
      ]
    }
  ],
  "abilities": {}
}