{
  "name": "Survivor (Lv1)",
  "archetype": "Survivor",
  "level": 1,
  "hp": 18,
  "ac": 16,
  "fort": 5,
  "ref": 8,
  "will": 6,
  "speed": 25,
  "max_ap": 3,
  "status": 0,
  "civil_spire_legal": true,
  "civil_ac_penalty": 0,
  "unarmed_damage_dice": "1d4",
  "unarmed_bonus": 6,
  "unarmed_flat_dmg": 1,
  "unarmed_traits": [
    "agile",
    "nonlethal"
  ],
  "weapons": [
    {
      "name": "Utility Dagger / Shiv",
      "attack_bonus": 7,
      "damage_dice": "1d4",
      "flat_damage": 3,
      "damage_type": "P/S",
      "range": 0,
      "ap_cost": 0,
      "traits": [
        "agile",
        "finesse",
        "versatile_s"
      ],
      "allowed_environments": [
        "civil_spire",
        "high_radiant",
        "low_radiant",
        "the_neither"
      ]
    },
    {
      "name": "Concealed Hand Crossbow",
      "attack_bonus": 6,
      "damage_dice": "1d6",
      "flat_damage": 1,
      "damage_type": "P",
      "range": 50,
      "ap_cost": 0,
      "traits": [
        "concealed"
      ],
      "allowed_environments": [
        "high_radiant",
        "low_radiant",
        "the_neither"
      ]
    }
  ],
  "abilities": {}
}